{"schema":"report/v1","review_id":"3f1c2a9e-7b4d-4e8a-9c1f-2d5e6a7b8c90","repo":{"url":"https://github.com/o/r","commit_sha":"bbbbbbbbbbbbbbbbbbbbbbbbbbbbbbbbbbbbbbbb","ref":"main"},"depth":"deep","summary":{"critical":0,"high":1,"medium":0,"low":0,"info":0,"files_scanned":3},"findings":[],"attempt":1,"budget_no":1,"started_at":"2026-10-28T10:00:00Z","finished_at":"2026-10-28T10:05:00Z"}
